Year,Song,Artist,Failed Reason
1998,Off Da Hook,지누션,No suitable video
1999,흑백논리 (Black and White Logic),YG Family,Every channel is None or video duration is not between 60 and 600 seconds
1999,흑백논리 (Black and White Logic),YG Family,No suitable video
1998,천사들의 늪 (Trapped),Shinhwa,Every channel is None or video duration is not between 60 and 600 seconds
1998,천사들의 늪 (Trapped),Shinhwa,No suitable video
1998,뭐가 나 (What’s Up),1TYM,No suitable video
1999,자유선언 (Declaration of Freedom),Click-B,No suitable video
1998,기억해 (Remember),S.E.S.,No suitable video
